[
  {
    "id": "mock-record-0",
    "source": "helpcommunity",
    "url": "https://example.com/mock-post",
    "date": "2026-08-29T09:44:03.804Z",
    "raw_text": "I was trying to find an old photo of my dog. I knew it was taken around 2019. I searched for it but I couldn't find it anywhere. It's so frustrating because I know it's there!",
    "photo_type": "document",
    "remembered_attributes": [
      "time period"
    ],
    "forgotten_attributes": [
      "exact date"
    ],
    "search_strategy_used": "keyword search",
    "failure_point": "couldn't formulate query",
    "outcome": "found by accident",
    "emotional_stakes": "low",
    "workaround_used": "none",
    "query_formulation": {
      "style": "natural_language_description",
      "example_query_paraphrased": "photo of my dog from last summer",
      "query_matched_forgotten_gap": true
    }
  },
  {
    "id": "mock-record-1",
    "source": "playstore",
    "url": "https://example.com/mock-post",
    "date": "2026-09-12T06:54:21.366Z",
    "raw_text": "I was trying to find an old photo of my dog. I knew it was taken around 2019. I searched for it but I couldn't find it anywhere. It's so frustrating because I know it's there!",
    "photo_type": "receipt",
    "remembered_attributes": [
      "time period"
    ],
    "forgotten_attributes": [
      "exact date"
    ],
    "search_strategy_used": "search by person",
    "failure_point": "app limitation",
    "outcome": "gave up",
    "emotional_stakes": "medium",
    "workaround_used": "none",
    "query_formulation": {
      "style": "natural_language_description",
      "example_query_paraphrased": "photo of my dog from last summer",
      "query_matched_forgotten_gap": true
    }
  },
  {
    "id": "mock-record-2",
    "source": "helpcommunity",
    "url": "https://example.com/mock-post",
    "date": "2026-07-10T06:59:15.289Z",
    "raw_text": "I was trying to find an old photo of my receipt. I knew it was taken around last summer. I searched for it but I couldn't find it anywhere. It's so frustrating because I know it's there!",
    "photo_type": "food",
    "remembered_attributes": [
      "occasion",
      "emotion/context",
      "time period"
    ],
    "forgotten_attributes": [
      "exact date"
    ],
    "search_strategy_used": "keyword search",
    "failure_point": "app limitation",
    "outcome": "found",
    "emotional_stakes": "low",
    "workaround_used": "none",
    "query_formulation": {
      "style": "natural_language_description",
      "example_query_paraphrased": "photo of my dog from last summer",
      "query_matched_forgotten_gap": true
    }
  },
  {
    "id": "mock-record-3",
    "source": "reddit",
    "url": "https://example.com/mock-post",
    "date": "2026-06-20T21:04:35.565Z",
    "raw_text": "I was trying to find an old photo of my friends. I knew it was taken around Christmas. I searched for it but I couldn't find it anywhere. It's so frustrating because I know it's there!",
    "photo_type": "event",
    "remembered_attributes": [
      "time period",
      "visual details"
    ],
    "forgotten_attributes": [
      "exact date"
    ],
    "search_strategy_used": "gave up before trying",
    "failure_point": "app limitation",
    "outcome": "gave up",
    "emotional_stakes": "high",
    "workaround_used": "none",
    "query_formulation": {
      "style": "natural_language_description",
      "example_query_paraphrased": "photo of my dog from last summer",
      "query_matched_forgotten_gap": true
    }
  },
  {
    "id": "mock-record-4",
    "source": "reddit",
    "url": "https://example.com/mock-post",
    "date": "2026-08-19T18:57:25.175Z",
    "raw_text": "I was trying to find an old photo of my friends. I knew it was taken around Christmas. I searched for it but I couldn't find it anywhere. It's so frustrating because I know it's there!",
    "photo_type": "person",
    "remembered_attributes": [
      "occasion",
      "visual details"
    ],
    "forgotten_attributes": [
      "exact date"
    ],
    "search_strategy_used": "manual scroll",
    "failure_point": "no results",
    "outcome": "found",
    "emotional_stakes": "high",
    "workaround_used": "none",
    "query_formulation": {
      "style": "natural_language_description",
      "example_query_paraphrased": "photo of my dog from last summer",
      "query_matched_forgotten_gap": true
    }
  },
  {
    "id": "mock-record-5",
    "source": "helpcommunity",
    "url": "https://example.com/mock-post",
    "date": "2026-06-07T01:54:26.157Z",
    "raw_text": "I was trying to find an old photo of my vacation. I knew it was taken around last summer. I searched for it but I couldn't find it anywhere. It's so frustrating because I know it's there!",
    "photo_type": "receipt",
    "remembered_attributes": [
      "visual details"
    ],
    "forgotten_attributes": [
      "exact date"
    ],
    "search_strategy_used": "gave up before trying",
    "failure_point": "no results",
    "outcome": "found by accident",
    "emotional_stakes": "low",
    "workaround_used": "none",
    "query_formulation": {
      "style": "natural_language_description",
      "example_query_paraphrased": "photo of my dog from last summer",
      "query_matched_forgotten_gap": true
    }
  },
  {
    "id": "mock-record-6",
    "source": "helpcommunity",
    "url": "https://example.com/mock-post",
    "date": "2026-07-20T19:25:49.593Z",
    "raw_text": "I was trying to find an old photo of my dog. I knew it was taken around last summer. I searched for it but I couldn't find it anywhere. It's so frustrating because I know it's there!",
    "photo_type": "event",
    "remembered_attributes": [
      "occasion"
    ],
    "forgotten_attributes": [
      "exact date"
    ],
    "search_strategy_used": "search by location",
    "failure_point": "couldn't formulate query",
    "outcome": "found by accident",
    "emotional_stakes": "low",
    "workaround_used": "none",
    "query_formulation": {
      "style": "natural_language_description",
      "example_query_paraphrased": "photo of my dog from last summer",
      "query_matched_forgotten_gap": true
    }
  },
  {
    "id": "mock-record-7",
    "source": "playstore",
    "url": "https://example.com/mock-post",
    "date": "2026-06-25T01:05:10.392Z",
    "raw_text": "I was trying to find an old photo of my dog. I knew it was taken around last summer. I searched for it but I couldn't find it anywhere. It's so frustrating because I know it's there!",
    "photo_type": "other",
    "remembered_attributes": [
      "device",
      "people present"
    ],
    "forgotten_attributes": [
      "exact date"
    ],
    "search_strategy_used": "gave up before trying",
    "failure_point": "no results",
    "outcome": "found",
    "emotional_stakes": "low",
    "workaround_used": "none",
    "query_formulation": {
      "style": "natural_language_description",
      "example_query_paraphrased": "photo of my dog from last summer",
      "query_matched_forgotten_gap": true
    }
  },
  {
    "id": "mock-record-8",
    "source": "helpcommunity",
    "url": "https://example.com/mock-post",
    "date": "2026-09-01T06:16:54.165Z",
    "raw_text": "I was trying to find an old photo of my vacation. I knew it was taken around Christmas. I searched for it but I couldn't find it anywhere. It's so frustrating because I know it's there!",
    "photo_type": "receipt",
    "remembered_attributes": [
      "time period"
    ],
    "forgotten_attributes": [
      "exact date"
    ],
    "search_strategy_used": "keyword search",
    "failure_point": "couldn't formulate query",
    "outcome": "gave up",
    "emotional_stakes": "high",
    "workaround_used": "none",
    "query_formulation": {
      "style": "natural_language_description",
      "example_query_paraphrased": "photo of my dog from last summer",
      "query_matched_forgotten_gap": true
    }
  },
  {
    "id": "mock-record-9",
    "source": "reddit",
    "url": "https://example.com/mock-post",
    "date": "2026-07-06T02:50:26.599Z",
    "raw_text": "I was trying to find an old photo of my friends. I knew it was taken around last summer. I searched for it but I couldn't find it anywhere. It's so frustrating because I know it's there!",
    "photo_type": "pet",
    "remembered_attributes": [
      "device",
      "occasion"
    ],
    "forgotten_attributes": [
      "exact date"
    ],
    "search_strategy_used": "gave up before trying",
    "failure_point": "app limitation",
    "outcome": "gave up",
    "emotional_stakes": "high",
    "workaround_used": "none",
    "query_formulation": {
      "style": "natural_language_description",
      "example_query_paraphrased": "photo of my dog from last summer",
      "query_matched_forgotten_gap": true
    }
  },
  {
    "id": "mock-record-10",
    "source": "helpcommunity",
    "url": "https://example.com/mock-post",
    "date": "2026-06-16T08:48:59.195Z",
    "raw_text": "I was trying to find an old photo of my friends. I knew it was taken around last summer. I searched for it but I couldn't find it anywhere. It's so frustrating because I know it's there!",
    "photo_type": "place",
    "remembered_attributes": [
      "device",
      "people present"
    ],
    "forgotten_attributes": [
      "exact date"
    ],
    "search_strategy_used": "gave up before trying",
    "failure_point": "wrong result surfaced",
    "outcome": "gave up",
    "emotional_stakes": "low",
    "workaround_used": "none",
    "query_formulation": {
      "style": "natural_language_description",
      "example_query_paraphrased": "photo of my dog from last summer",
      "query_matched_forgotten_gap": true
    }
  },
  {
    "id": "mock-record-11",
    "source": "reddit",
    "url": "https://example.com/mock-post",
    "date": "2026-07-09T18:28:52.056Z",